{
    "$schema": "http://json-schema.org/draft-07/schema#",
    "type": "object",
    "properties": {
        "config": {
            "allOf": [
                {
                    "$ref": "#/definitions/hasRef"
                }
            ]
        },
        "python": {
            "allOf": [
                {
                    "$ref": "#/definitions/hasRef"
                }
            ]
        },
        "api": {
            "allOf": [
                {
                    "$ref": "#/definitions/hasRef"
                }
            ],
            "type": "object",
            "properties": {
                "port": {
                    "type": "number",
                    "default": 10081,
                    "description": "Port which siibra-api will run on"
                },
                "redis": {
                    "type": "object",
                    "properties": {
                        "port": {
                            "type": "number",
                            "default": 6379,
                            "description": "Port which redis will be run on"
                        },
                        "disabled": {
                            "type": "boolean",
                            "default": false,
                            "description": "If Redis will be disabled"
                        }
                    }
                }
            }
        },
        "explorer": {
            "allOf": [
                {
                    "$ref": "#/definitions/hasRef"
                }
            ],
            "properties": {
                "port": {
                    "type": "number",
                    "default": 8080,
                    "description": "Port by which siibra-explorer will run."
                },
                "host": {
                    "type": "string",
                    "default": "localhost",
                    "description": "Host of API which siibra-explorer will call."
                }
            }
        },
        "version": {
            "const": "0.0.1"
        }
    },
    "definitions": {
        "hasRef": {
            "type": "object",
            "properties": {
                "ref": {
                    "type": "string",
                    "description": "PATH to git repo or REFTAG"
                }
            }
        }
    }
}
