{
    "$schema": "https://raw.githubusercontent.com/FZJ-INM1-BDA/siibra-compose/refs/heads/master/siibra-compose-schema.json",
    "version": "0.0.1",
    "explorer": {
        "port": 7700,
        "ref": "master"
    },
    "api": {
        "redis": {
            "disabled": true
        },
        "ref": "master"
    },
    "python": {
        "ref": "v0.4a87"
    },
    "config": {
        "ref": "siibra-0.4a87"
    }
}
